id	domain	intent	src_utt	translated-tgt_utt	eval_text_translation
10047	Spotify	ShowDanceability	get the danceability of that track	weź odtwarzanie tego utworu	0
10023	Spotify	ShowDanceability	how dancey is that track	jak taneczny jest ten utwór	1
6587	Email	ShowEmailFromSender	display my emails from b.fugah@quinnemanuel.com	pokaż moje emaile od b.fugah@quinnemanuel.com	1
6606	Email	ShowEmailFromSender	search for my emails i received from jeffrey@gmail.com	wyszukaj czy w skrzynce nie ma czegoś od jeffrey@gmail.com	1
6571	Email	ShowEmailFromSender	show me emails i got from elva@yahoogroups.com	pokaż moje maile od elva@yahoogroups.com	1
6607	Email	ShowEmailFromSender	read new emails from lyle@gmail.com	przeczytaj emaile od lyle@gmail.com	1
6610	Email	ShowEmailFromSender	read my emails from tyra@gmail.com	przeczytaj moje emaile od tyra@gmail.com	1
6586	Email	ShowEmailFromSender	check out my new emails i received from tristan@gmail.com	sprawdź czy w skrzynce nie ma czegoś od tristan@gmail.com	1
6598	Email	ShowEmailFromSender	tell me if i have received emails from edna@apx.com	powiedz mi czy otrzymałem emaila od edna@apx.com	1
6613	Email	ShowEmailFromSender	do i have any emails from h.mikulec@energy.state.ca.us	czy mam jakieś maile od h.mikulec@energy.state.ca.us	1
6596	Email	ShowEmailFromSender	tell me if i have any emails from shaun@gmail.com	powiedz czy mam jakieś maile od shaun@gmail.com	1
6614	Email	ShowEmailFromSender	do i have any new emails from cecilla@gmail.com	czy mam jakieś nowe emaile od cecilla@gmail.com	1
6624	Email	ShowEmailFromTime	show me my emails that arrived on sunday	pokaż mi moje maile przychodzące w niedzielę	0
6633	Email	ShowEmailFromTime	display my emails that arrived on 10th February	pokaż moje maile przychodzące 10 lutego	0
6623	Email	ShowEmailFromTime	show me emails received today	pokaż moje maile które dostałem dzisiaj	1
6647	Email	ShowEmailFromTime	search for my emails received on 6th October 2024	wyszukaj moje maile otrzymane 6 października 2024 roku	1
6625	Email	ShowEmailFromTime	show me my emails received yesterday	pokaż moje wczoraj otrzymane maile	0
6648	Email	ShowEmailFromTime	give me emails from on 6th July 2024	pokaż maile z 6 lipca 2024 roku	1
6644	Email	ShowEmailFromTime	search for my emails that arrived on 30th may	wyszukaj moje maile przychodzące 30 maja	1
6636	Email	ShowEmailFromTime	display my emails received on 24th November	pokaż moje maile otrzymane z 24 listopada	0
6639	Email	ShowEmailFromTime	find my emails that arrived on 24th August	znajdź moje maile które przybyły 24 sierpnia	1
6632	Email	ShowEmailFromTime	display emails received on 26th July	pokaż maile otrzymane z 26 lipca	0
6656	Email	ShowEmailWithLabel	display my emails that have a label hobby	pokaż moje maile które mają znacznik hobby	1
6664	Email	ShowEmailWithLabel	give me games emails right away	dajcie mi gry teraz maile	0
6658	Email	ShowEmailWithLabel	find my emails with a label important	znajdź moje maile z ważną etykietą	0
6652	Email	ShowEmailWithLabel	get my emails labelled official	daj moje maile oznaczone oficjalnym	0
6654	Email	ShowEmailWithLabel	display emails that have a label tech	pokaż maile które mają tag <a>technologia<a>	1
6649	Email	ShowEmailWithLabel	show me my emails labelled notifications	pokaż mi powiadomienia z podpisem moich maili	0
6662	Email	ShowEmailWithLabel	search for my emails with a label research	wyszukaj moje maile z tagiem badań	0
6655	Email	ShowEmailWithLabel	display my emails labelled new topic	pokaż moje maile z nowym tematem	0
6660	Email	ShowEmailWithLabel	search for emails that have a label animals	wyszukaj maile które mają tag zwierząt	0
6665	Email	ShowEmailWithLabel	give me meme emails quickly	daj mi szybko maile meme	0
6680	Email	ShowEmailWithPriority	find my postpone priority emails	znajdź moje maile z priorytetami	0
6668	Email	ShowEmailWithPriority	show me my later priority emails	pokaż mi moje ostatnie maile z priorytetem	1
6671	Email	ShowEmailWithPriority	get me high priority emails first	daj mi najpierw ważne maile	0
6672	Email	ShowEmailWithPriority	get my ongoing emails	pokaż moje bieżące maile	1
6666	Email	ShowEmailWithPriority	show me high priority emails	pokaż mi ważne maile	1
6681	Email	ShowEmailWithPriority	give me all emails with important priority	daj mi wszystkie maile z ważnym priorytetem	1
6670	Email	ShowEmailWithPriority	get me unimportant priority emails	daj mi nieważne priorytetowe emaile	0
6676	Email	ShowEmailWithPriority	display medium emails first	wyświetl średnie maile	0
6669	Email	ShowEmailWithPriority	show me my low priority emails first	pokaż mi moje maile z niskim priorytetem	1
6674	Email	ShowEmailWithPriority	get my postpone priority emails	pokaż moje priorytetowe emaile	1
6701	Email	ShowEmailWithSubject	give me emails about kelemen is doing a great job	daj mi emaile o tym że kelemen robi świetną pracę	1
6689	Email	ShowEmailWithSubject	display my emails with a subject streaks than cold streaks	pokaż moje maile z tematem streaks niż cold streaks	0
6684	Email	ShowEmailWithSubject	get emails with a subject thanks all for your help for now	pokaż maile z tematem dziękuję za twoją pomoc	1
6696	Email	ShowEmailWithSubject	search for emails with a subject revenue shortfall surcharge	wyszukaj maile w temacie wpisując niedobór przychodu	0
6690	Email	ShowEmailWithSubject	find emails with a subject thanks so much for the response	znajdź maile z tematem dziękuję za odpowiedź	1
6694	Email	ShowEmailWithSubject	find my emails with a subject and staff are invited to attend	znajdź moje maile z tematem i personel jest zaproszony na spotkanie	0
6700	Email	ShowEmailWithSubject	give me emails about re: including the propriety of tlrs	wyślij mi emaile o re : including the property of tlrs	0
6685	Email	ShowEmailWithSubject	get my emails with a subject re: used in the initial assessment	pokaż moje maile z tematem re: używany w ocenie początkowej	1
6695	Email	ShowEmailWithSubject	search for emails with a subject re: overcharges by energy suppliers	wyszukaj maile o temacie <a>re nie pojawia się w raporcie o obrażeniach	0
6691	Email	ShowEmailWithSubject	find emails with a subject should not be charged for them	wyszukaj maile z tematem nie powinny być załatwione	0
7349	Gdrive	ShowFilesFromTime	show my google drive files created this january	pokaż moje pliki w google drive stworzone w tym styczniu	1
7367	Gdrive	ShowFilesFromTime	download my google cloud files created last march	pobierz moje pliki w google cloud stworzone w marcu ubiegłego roku	0
7363	Gdrive	ShowFilesFromTime	down lod gulgulclide files modified last december	down lod gulgulclide pliki modyfikowane w ubiegłym grudnia	0
7368	Gdrive	ShowFilesFromTime	download my google cloud files modified last friday	pobierz moje pliki w google cloud modyfikowane w ostatni piątek	0
7360	Gdrive	ShowFilesFromTime	search for my google drive files created this march	wyszukaj moje pliki w google drive stworzone w tym marcu	1
7353	Gdrive	ShowFilesFromTime	display my google drive files modified last wednesday	pokaż moje pliki w google drive modyfikowane w ostatnią środę	1
7356	Gdrive	ShowFilesFromTime	list my google drive files modified this august	pokaż moje pliki w google drive zmodyfikowane w tym sierpniu	1
7352	Gdrive	ShowFilesFromTime	display my google files modified last july	pokaż moje pliki z google modyfikowane w zeszłym lipcu	1
7354	Gdrive	ShowFilesFromTime	list my google files modified last saturday	pokaż moje pliki z google zmienione w ostatnią sobotę	1
7362	Gdrive	ShowFilesFromTime	download google cloud files created last september	ściągnij pliki z google cloud stworzone we wrześniu	1
7369	Gdrive	ShowFilesWithSize	show for my google drive larger than 1 gigabyte	pokaż dla mojego google drive większy niż 1 gigabyte	0
7376	Gdrive	ShowFilesWithSize	find my google drive files smaller than 9 gigabyte	moje pliki w google drive są mniejsze niż 9 gigabyte	0
7382	Gdrive	ShowFilesWithSize	download my google drive files smaller than 700 mb	pobieranie plików w google drive mniej niż 700 mb	0
7370	Gdrive	ShowFilesWithSize	show for my google drive files smaller than 6 gigabyte	pokaż moje pliki w google drive mniej niż 6 gigabyte	0
7379	Gdrive	ShowFilesWithSize	search for my google drive files larger than 800 kb	wyszukaj dla plików w google drive większych niż 800 kb	0
7383	Gdrive	ShowFilesWithSize	download my google cloud files larger than 500 mb	pobieraj moje pliki w google cloud większe niż 500 mb	0
7377	Gdrive	ShowFilesWithSize	find my google drive files larger than 10 mb	znajdź moje pliki w google drive większe niż 10 mb	1
7375	Gdrive	ShowFilesWithSize	find my google files larger than 1 mb	znajdź moje pliki na google większe niż 1 mb	1
7381	Gdrive	ShowFilesWithSize	download google cloud files larger than 8 gigabyte	pobieranie plików w google cloud większych niż 8 gigabyte	0
7372	Gdrive	ShowFilesWithSize	display my google drive files larger than 900 mb	pokaż moje pliki w google drive większe niż 900 mb	1
7384	Gdrive	ShowFilesWithStar	show the google drive files i starred	pokaż moje pliki w google drive oznaczone gwiazdką	1
7392	Gdrive	ShowFilesWithStar	download my google drive files with stars	ściągnij moje pliki z google drive z gwiazdkami	0
7386	Gdrive	ShowFilesWithStar	search for the google drive files i starred	szukam plików w google drive oznaczonych gwiazdką	1
7385	Gdrive	ShowFilesWithStar	display my starred google drive files	wyświetl moje pliki z google drive oznaczone gwiazdką	1
7387	Gdrive	ShowFilesWithStar	list my starred google files	wymień moje pliki z google oznaczone gwiazdką	1
7389	Gdrive	ShowFilesWithStar	list my starred google drive files	wymień moje pliki z google drive oznaczone gwiazdką	1
7388	Gdrive	ShowFilesWithStar	list my starrd gugle drive files	wymień moje pliki w strefie starrd gugle drive	0
7391	Gdrive	ShowFilesWithStar	download google cloud files with stars	ściągnij pliki z google cloud z gwiazdkami	0
7390	Gdrive	ShowFilesWithStar	list the google drive files i starred	wymień moje pliki w google drive oznaczone gwiazdką	1
7395	Gdrive	ShowFilesWithType	search for my wav files in google drive	wyszukaj moje pliki wav w google drive	1
7396	Gdrive	ShowFilesWithType	show my flac files in google drive	pokaż moje pliki w google drive	0
7400	Gdrive	ShowFilesWithType	download google cloud files of type txt	ściągnij pliki w google cloud z typem txt	0
7394	Gdrive	ShowFilesWithType	search for my google drive files of type jar	wyszukaj moje pliki w google drive z typem jar	0
7397	Gdrive	ShowFilesWithType	display my docx files in google drive	pokaż moje pliki docx w google drive	1
7402	Gdrive	ShowFilesWithType	download my google cloud files of type png	pobierz moje pliki w google cloud z typem png	0
7399	Gdrive	ShowFilesWithType	list my py files in google drive	wymień moje py pliki w google drive	1
7398	Gdrive	ShowFilesWithType	list my google drive files of type md5	wymień moje pliki w google drive z typem md5	1
7401	Gdrive	ShowFilesWithType	download my google drive files of type jpeg	pobierz moje pliki w google drive z typem jpeg	0
7393	Gdrive	ShowFilesWithType	find my jpeg files in google drive	znajdź moje pliki jpeg w google drive	1
7579	Instagram	ShowLastNumberPictures	show me my 13 recent insta pictures on my account	pokaż mi moje 13 ostatnich zdjęć na moim koncie na insta	1
7586	Instagram	ShowLastNumberPictures	display my 15 latest instagram pictures	pokaż mi moje 15 ostatnich zdjęć na instagramie	1
7585	Instagram	ShowLastNumberPictures	display my fifteen latest and stegram pictures	pokaż mi moje piętnaście najnowszych i aplikowanych zdjęć	0
7597	Instagram	ShowLastNumberPictures	search for my 3 recent insta pictures	wyszukaj moje 3 ostatnie zdjęcia na insta	1
7580	Instagram	ShowLastNumberPictures	show me my 19 latest instagram pictures	pokaż mi moje 19 ostatnich zdjęć na instagramie	1
7605	Instagram	ShowLastNumberPictures	how do i look on newest 20 instagram images	jak wyglądają najnowsze 20 zdjęć na instagramie	0
7607	Instagram	ShowLastNumberPictures	compare my newest 5 instagram photos	porównaj moje najnowsze 5 zdjęć na instagramie	1
7591	Instagram	ShowLastNumberPictures	list my 2 recent insta pictures on my account	pokaż mi moje 2 ostatnie zdjęcia na moim koncie na insta	1
7595	Instagram	ShowLastNumberPictures	find my 9 latest instagram pictures on my account	znajdź mi moje najnowsze 9 zdjęć na moim koncie na instagramie	1
7577	Instagram	ShowLastNumberPictures	show me my 4 recent instagram pictures on my account	pokaż mi moje 4 ostatnie zdjęcia na moim koncie na instagramie	1
7410	Gdrive	ShowNewestFiles	list my newest google drive files	wymień moje najnowsze pliki na google drive	1
7404	Gdrive	ShowNewestFiles	show my google drive files that were created most recently	pokaż moje najnowsze pliki na google drive	0
7405	Gdrive	ShowNewestFiles	display my newest google drive files	wyświetl moje najnowsze pliki na google drive	1
7413	Gdrive	ShowNewestFiles	filter my google drive files that were created most recently	filtruj moje najnowsze pliki na google drive	0
7403	Gdrive	ShowNewestFiles	show my newest google drive files	pokaż moje najnowsze pliki na google drive	1
7409	Gdrive	ShowNewestFiles	sort my google drive files created most recently	sortuj moje najnowsze pliki na google drive	0
7411	Gdrive	ShowNewestFiles	list my google drive files that were created most recently	pokaż moje najnowsze pliki na google drive	0
7406	Gdrive	ShowNewestFiles	display my google drive files that were created most recently	pokaż moje najnowsze pliki na google drive	0
7412	Gdrive	ShowNewestFiles	find my google drive files that were created most recently	znajdź moje najnowsze pliki na google drive	0
7408	Gdrive	ShowNewestFiles	sort my google files starting from created most recently	sortuj moje pliki google zaczynające się od najnowszych utworzonych	0
8186	News	ShowNews	open wired portal	otwórz wired portal	1
8187	News	ShowNews	read time magazine portal	przeczytaj czasopisma	0
8190	News	ShowNews	check the latest news from new york times	sprawdź najnowsze wiadomości z new york times	1
8193	News	ShowNews	listen to the news from time magazine portal	posłuchaj wiadomości z portalu czasopisma	0
8203	News	ShowNews	pull latest articles from time magazine	ściągnij ostatnie artykuły z czasopisma	0
8197	News	ShowNews	read me the news from wired	przeczytaj mi wiadomości wired	0
8192	News	ShowNews	listen to the news from time	posłuchaj najnowszych wiadomości	0
8191	News	ShowNews	check the new information from nyt	sprawdź informacje od teraz	0
8199	News	ShowNews	display the new information from fox news	wyświetl informacje z fox news	1
8204	News	ShowNews	what's new according to huffington post portal	co nowego według portalu huffington post	1
8152	News	ShowNewsFromSection	read the celebrity section of the huffpost	przeczytaj wiadomości z sekcji	0
8167	News	ShowNewsFromSection	check the huffpost sport section	sprawdź informacje z sekcji huffpost	0
8178	News	ShowNewsFromSection	i want to listen to the celebrity section of the huffington post	posłuchaj wiadomości z portalu huffington post	0
8164	News	ShowNewsFromSection	check for me the sport section of the fox news	sprawdź informacje z sekcji	0
8154	News	ShowNewsFromSection	show me the techcrunch health section	pokaż informacje z kategorii zdrowotnej na techcrunch	1
8157	News	ShowNewsFromSection	show me the wired celebrity section	pokaż wiadomości z sekcji	0
8185	News	ShowNewsFromSection	what's new in the celebrity topic on nyt	co nowego w temacie celebryty	0
8153	News	ShowNewsFromSection	show me the tech section of the huffpost	pokaż informacje z sekcji huffpost	0
8160	News	ShowNewsFromSection	open the sport section of the time	otwórz informacje z sekcji	0
8169	News	ShowNewsFromSection	check for me the new york times tech section	sprawdź informacje z sekcji new york times	0
7425	Gdrive	ShowOldestFiles	list least recently created google drive files	wymień najstarsze pliki na google drive	1
7431	Gdrive	ShowOldestFiles	search for my least recently created google drive files	wyszukaj moje najstarsze pliki na google drive	1
7427	Gdrive	ShowOldestFiles	find oldest google drive files	znajdź najstarsze pliki na google drive	1
7421	Gdrive	ShowOldestFiles	sort my google drive files most recent	sortuj moje najnowsze pliki na google drive	1
7426	Gdrive	ShowOldestFiles	fine goldestgoodle drive files	fajne pliki goldestgoodle drive	0
7416	Gdrive	ShowOldestFiles	display my oldest google drive files	wyświetl moje najstarsze pliki na google drive	1
7422	Gdrive	ShowOldestFiles	sort my google drive files starting most recent	sortuj moje pliki w google drive zaczynając od najnowszych	1
7415	Gdrive	ShowOldestFiles	show my least recently created google drive files	pokaż moje najstarsze pliki na google drive	1
7417	Gdrive	ShowOldestFiles	display my least recently created google files	wyświetl moje najstarsze pliki na google drive	1
7414	Gdrive	ShowOldestFiles	show my least recently created google files	pokaż moje najstarsze pliki na google drive	1
7981	Instagram	ShowPictures	what's the latest stuff on instagram	jakie jest najnowsze informacje na instagramie	0
7967	Instagram	ShowPictures	display my recent insta photos	pokaż mi moje ostatnie wpisy na instagramie	0
7966	Instagram	ShowPictures	display my recent insta pictures	pokaż mi moje ostatnie wpisy na instagramie	0
7959	Instagram	ShowPictures	show me my instagram pictures	pokaż mi moje zdjęcia na instagramie	1
7956	Instagram	ShowPictures	show my recent instagram pictures	pokaż mi moje ostatnie zdjęcia na instagramie	1
7976	Instagram	ShowPictures	search for my insta photos	poszukaj zdjęć na moim insta	1
7979	Instagram	ShowPictures	present my instagram images	pokaż moje zdjęcia na instagramie	0
7973	Instagram	ShowPictures	find my recent instagram pictures	znajdź mi moje ostatnie zdjęcia na instagramie	1
7962	Instagram	ShowPictures	show me my recent instagram pictures	pokaż mi moje ostatnie zdjęcia na instagramie	1
7978	Instagram	ShowPictures	search for my recent insta pictures	poszukaj moich ostatnich zdjęć na insta	1
7625	Instagram	ShowPicturesFromDate	list my posts from the 18th of August	pokaż moje posty z 18 sierpnia	1
7620	Instagram	ShowPicturesFromDate	display my posts from the 22nd of September	pokaż moje posty z 22 września	1
7627	Instagram	ShowPicturesFromDate	find my posts from the fourteenth of february	znajdź moje posty z 14 lutego	1
7611	Instagram	ShowPicturesFromDate	show me my posts from April	pokaż moje posty z kwietnia	1
7631	Instagram	ShowPicturesFromDate	search for my posts from the 13th of March	wyszukaj moje posty z 13 marca	1
7628	Instagram	ShowPicturesFromDate	find my posts from the 14th of February	znajdź moje posty z 14 lutego	1
7612	Instagram	ShowPicturesFromDate	show my posts from May	pokaż moje posty z maja	1
7636	Instagram	ShowPicturesFromDate	what was i doing on instagram on 15th	co robiłem na instagramie 15th	0
7624	Instagram	ShowPicturesFromDate	list my post from October	pokaż moje posty z października	1
7618	Instagram	ShowPicturesFromDate	display my posts from September	pokaż moje posty z września	1
7649	Instagram	ShowPicturesWithFilter	show me mi and stargrand pictures with pilter nashwall	pokaż mi zdjęcia mi i gwiazdy z pilter nashwall	0
7682	Instagram	ShowPicturesWithFilter	search for my insta pictures that have the nashville filter applied	wyszukaj moje zdjęcia na instagramie które używają filtra nashville	1
7637	Instagram	ShowPicturesWithFilter	show my insta pictures that have the amaro filter applied	pokaż mi zdjęcia na instagramie które używają filtra amaro	1
7661	Instagram	ShowPicturesWithFilter	display my insta pictures that use filter ludwig	pokaż moje zdjęcia na instagramie które używają filtra ludwig	1
7653	Instagram	ShowPicturesWithFilter	show me my insta pictures that have the crema filter applied	pokaż mi zdjęcia na instagramie które używają filtra kremy	0
7644	Instagram	ShowPicturesWithFilter	show my instagram pictures that have the crema filter	pokaż mi moje zdjęcia na instagramie które mają filtr kremy	0
7689	Instagram	ShowPicturesWithFilter	do i look well with clarendon filter on	czy wyglądam dobrze z filtrem clarendon	1
7684	Instagram	ShowPicturesWithFilter	search for my instagram pictures that have the hefe filter applied	wyszukaj moje zdjęcia na instagramie które używają filtra hefe	1
7663	Instagram	ShowPicturesWithFilter	display my insta pictures that have the rise filter applied	pokaż moje zdjęcia na instagramie które używają filtra rise	1
7695	Instagram	ShowPicturesWithFilter	how does photos with moon filter looks like	jak wyglądają zdjęcia z filtrem księżyca	0
7699	Instagram	ShowPicturesWithHashtag	show my instagram pictures tagged summer2k17	pokaż moje zdjęcia na instagramie z tagiem summer2k17	1
7718	Instagram	ShowPicturesWithHashtag	present my instagram photos tagged as instadog	pokaż moje zdjęcia na instagramie które mają tag jako instadog	1
7720	Instagram	ShowPicturesWithHashtag	present them my instagram photos tagged as fashion	pokaż mi zdjęcia na instagramie które mają tag jako mody	0
7711	Instagram	ShowPicturesWithHashtag	search for my instagram pictures tagged newyears2017	wyszukaj moje zdjęcia na instagramie z tagiem newyears2017	1
7725	Instagram	ShowPicturesWithHashtag	hashtag targetclearance on my instagram	hashtag docelowy wyczyść na moim instagramie	0
7703	Instagram	ShowPicturesWithHashtag	display my instagram pictures tagged art	pokaż moje zdjęcia na instagramie z tagiem art	1
7715	Instagram	ShowPicturesWithHashtag	present my instagram photos with tag makeup	pokaż moje zdjęcia na instagramie z tagiem makeup	1
7706	Instagram	ShowPicturesWithHashtag	display my insta pictures tagged handbag	pokaż moje zdjęcia na instagramie z tagiem handbag	1
7704	Instagram	ShowPicturesWithHashtag	display my instagram pictures tagged blacklove	pokaż moje zdjęcia na instagramie z tagiem blacklove	1
7698	Instagram	ShowPicturesWithHashtag	show me my insta pictures tagged markers	pokaż moje zdjęcia na instagramie z tagiem markers	1
7925	Instagram	ShowPicturesWithLocation	search for the instagram pictures taken in chadbourn	wyszukaj zdjęcia na instagramie które zrobiłem na chadbourn	1
7882	Instagram	ShowPicturesWithLocation	find my insta pictures taken when i was in holland patent	znajdź moje zdjęcia na instagramie które zrobiłem kiedy byłem w holenderskim patencie	0
7841	Instagram	ShowPicturesWithLocation	list my instagram pictures i took in crystal hill	pokaż moje zdjęcia na instagramie które zrobiłem w crystal hill	1
7908	Instagram	ShowPicturesWithLocation	find my insta pictures i took when i was in herrick	znajdź moje zdjęcia na instagramie które zrobiłem kiedy byłem w herrick	1
7751	Instagram	ShowPicturesWithLocation	show me my insta pictures tagged with location fox lake	pokaż mi moje zdjęcia na instagramie które mają tag na fox lake	0
7773	Instagram	ShowPicturesWithLocation	show my instagram pictures with gps tag dillon beach	pokaż moje zdjęcia na instagramie z tagiem dillon beach	0
7782	Instagram	ShowPicturesWithLocation	show me the instagram pictures with gps tag briggsdale	pokaż mi zdjęcia na instagramie które mają tag briggsdale	0
7813	Instagram	ShowPicturesWithLocation	display my insta pictures with geolocation tag depauw	pokaż moje zdjęcia na instagramie z tagiem geolokalizacja depauw	1
7868	Instagram	ShowPicturesWithLocation	list my instagram pictures taken in manahawkin	pokaż moje zdjęcia na instagramie które zrobiłem w manahawkin	1
7926	Instagram	ShowPicturesWithLocation	search for the instagram pictures taken when i was in wheatfield	wyszukaj zdjęcia na instagramie które zrobiłem kiedy byłem w w wheatfield	0
8489	Phone	ShowSMS	check my texts	sprawdź moje smsy	1
8490	Phone	ShowSMS	show my latest texts	pokaż moje przychodzące smsy	0
8495	Phone	ShowSMS	i want to read my texts	przeczytaj moje smsy	0
8494	Phone	ShowSMS	launch my sms	uruchom moje smsy	1
8497	Phone	ShowSMS	i want to read new texts	przeczytaj smsy które dostałem	1
8491	Phone	ShowSMS	display my sms	wyświetl moje smsy	1
8492	Phone	ShowSMS	display my sms inbox	wyświetl moje przychodzące smsy	1
8496	Phone	ShowSMS	i want to read latest texts	przeczytaj smsy które do mnie przyszły	0
8493	Phone	ShowSMS	launch sms inbox	uruchom odebrane smsy	0
8498	Phone	ShowSMS	i want to read new sms	przeczytaj smsy które dostałem	1
7237	Fitbit	ShowSteps	tell me what's the number of steps on fitbit	powiedz mi liczbę kroków na fitbicie	1
7243	Fitbit	ShowSteps	display the number of steps on fitbit	pokaż liczbę kroków w fitbicie	1
7238	Fitbit	ShowSteps	tell me what's the number of steps i have taken	powiedz mi liczbę kroków którą zrobiłem	1
7246	Fitbit	ShowSteps	the number of steps from fitbit	liczbę kroków w fitbicie	0
7240	Fitbit	ShowSteps	show me what's the number of steps i took	pokaż mi liczbę kroków którą zrobiłem	1
7239	Fitbit	ShowSteps	show me the number of steps i have taken	pokaż mi liczbę kroków którą zrobiłem	1
7242	Fitbit	ShowSteps	show me what's the number of steps i have taken	pokaż mi liczbę kroków którą zrobiłem	1
7235	Fitbit	ShowSteps	tell me the number of steps i have taken	powiedz mi liczbę kroków którą zrobiłem	1
7247	Fitbit	ShowSteps	what's the distance i traveled today in steps	jak daleko jadłam dziś w krokach	0
7245	Fitbit	ShowSteps	measure the number of steps on fitbit	pomiń liczbę kroków w fitbicie	0
7218	Fitbit	ShowStepsOnDate	measure the number of steps i took on 3rd August	pomiń liczbę kroków którą zrobiłem 3 sierpnia	0
7228	Fitbit	ShowStepsOnDate	the step count from fitbit on 26th May	oblicz dystans który dziś przebyłem w krokach	0
