id	domain	intent	src_utt	translated-tgt_utt	eval_text_translation
16185	Youtube	FindQueryOnChannel	look for videos published by touristytraveler matching what ifs by kane brown on youtube	wyszukaj filmy opublikowane kanału touristytraveler które pasuje do tego co kanał kane brown na youtube	0
12832	Twitter	FollowUser	i'd like to listen to christastique	chcę posłuchać muzyki chrześcijańskiej	0
12830	Twitter	FollowUser	what francheska28 have said lately	co powiedziała ostatnio francheska28	1
12823	Twitter	FollowUser	notify me about recent changes on nestasw twitter	powiadom mnie o ostatnich zmianach na twitterze nestasw	1
12825	Twitter	FollowUser	subscribe to rahulsah on twitter	subskrybuj rahulsah na twitterze	1
12828	Twitter	FollowUser	be a twitter follower of k2daia	bądź obserwatorem twittera k2daia	1
12820	Twitter	FollowUser	i want to be up to date with muertenthesnw twitter	chcę się uaktualnić z twitterem muertenthesnw	0
12818	Twitter	FollowUser	become a twitter follower of john ordickable	zostań followerem twittera of john ordickable	1
12829	Twitter	FollowUser	spy on lynnloca on twitter	obserwuj lynnloca na twitterze	1
12817	Twitter	FollowUser	follow emilyclaiborne on twitter	obserwuj emilyclaiborne na twitterze	1
12824	Twitter	FollowUser	subscribe morefeen on twitter	zapisz więcej na twitterze	0
3375	Airconditioner	GetHumidity	give me the humidity in here	daj mi wilgotność tutaj	0
3378	Airconditioner	GetHumidity	tell me how humid is the air in here	powiedz mi jaki jest poziom wilgotności	1
3369	Airconditioner	GetHumidity	show me the humidity	pokaż mi jaki jest poziom wilgotności	1
3366	Airconditioner	GetHumidity	check the humidity	sprawdź poziom wilgotności	1
3377	Airconditioner	GetHumidity	give me the humidity level in here	podaj mi jaki jest poziom wilgotności	1
3370	Airconditioner	GetHumidity	show me the humidity level	pokaż mi jaki jest poziom wilgotności	1
3368	Airconditioner	GetHumidity	show the humidity in here	pokaż jaki jest poziom wilgotności	1
3365	Airconditioner	GetHumidity	check humidity level	sprawdź poziom wilgotności	1
3374	Airconditioner	GetHumidity	tell me what's the humidity level	powiedz jaki jest poziom wilgotności	1
3367	Airconditioner	GetHumidity	show the humidity in here	pokaż jaki jest poziom wilgotności	1
3458	Airconditioner	GetTemperature	tell me what's the temperature on my air conditioning	powiedz jaka jest temperatura w moim klimatyzacji	0
3491	Airconditioner	GetTemperature	it is too hot in here	jest tu za gorąco	1
3474	Airconditioner	GetTemperature	how many fahrenheits degrees are on my cooling system	ile stopni jazdy jest w moim systemie chłodzenia	0
3450	Airconditioner	GetTemperature	show me the temperature on my heating	pokaż mi temperaturę na moim ogrzewaniu	1
3476	Airconditioner	GetTemperature	how many celsius degrees are on my aircon	ile stopni celsius jest na moim lotniku	0
3481	Airconditioner	GetTemperature	what temperature do we have in here according to my hvac	jaka temperatura jest w tej okolicy według mojego wacha	0
3455	Airconditioner	GetTemperature	tell me what's the temperature on heating	powiedz mi jaka jest temperatura na ogrzewaniu	1
3446	Airconditioner	GetTemperature	show what's the temperature on mmy air conditioning	pokaż jaka jest temperatura na klimatyzacji mmy	1
3494	Airconditioner	GetTemperature	it is too chilly	za chłodno	0
3487	Airconditioner	GetTemperature	it is too hot	za gorąco	0
3418	Airconditioner	GetTemperatureFromDevice	tell me what's on the reception sensor	powiedz mi co jest w czujniku przyjęcia	0
3387	Airconditioner	GetTemperatureFromDevice	check the temperature on the pantry thermostat	sprawdź temperaturę na termostacie w pantry	1
3409	Airconditioner	GetTemperatureFromDevice	tell what's on the bedroom sensor	powiedz co jest w czujniku sypialni	0
3423	Airconditioner	GetTemperatureFromDevice	tell me what the foyer temperature sensor says	powiedz mi co mówi czujnik temperatury w foyer	1
3383	Airconditioner	GetTemperatureFromDevice	check what the max room thermostat says	sprawdź temperaturę maksymalną w pokoju	0
3436	Airconditioner	GetTemperatureFromDevice	measure the temperature of the parlor thermostat	pomiara temperaturę na termostacie w parze	0
3396	Airconditioner	GetTemperatureFromDevice	show what's on the laundry room sensor	pokaż czujnik prania	0
3386	Airconditioner	GetTemperatureFromDevice	check the temperature on the foyer thermostat	sprawdź temperaturę na termostacie w foyer	1
3403	Airconditioner	GetTemperatureFromDevice	show what's on the hall sensor	pokaż czujnik	0
3419	Airconditioner	GetTemperatureFromDevice	tell me what's on the reception room censor	powiedz mi co jest w censatorze w salonie	0
15566	Wikipedia	GoToElementNumber	jump to the sixth element in contents	przeskocz do szóstego elementu ze spisu treści	1
15537	Wikipedia	GoToElementNumber	jump to fifth element from contents	przeskocz do piątego elementu ze spisu treści	1
15433	Wikipedia	GoToElementNumber	navigate to the fir ditem in contents	nawiguj do motywu ognia	0
15416	Wikipedia	GoToElementNumber	navigate to seventh item from contents	przejdź do szóstego elementu ze spisu treści	0
15468	Wikipedia	GoToElementNumber	show tenth item from contents	pokaż dziesiątego elementu ze spisu treści	0
15594	Wikipedia	GoToElementNumber	open ninth paragraph	otwórz dziewiątego paragrafu	0
15379	Wikipedia	GoToElementNumber	go to the second item in contents	skocz do drugiego elementu ze spisu treści	1
15540	Wikipedia	GoToElementNumber	jump to sixth element in contents	przeskocz do szóstego elementu ze spisu treści	1
15453	Wikipedia	GoToElementNumber	navigate to the tenth element from contents	przejdź do dziesiątego elementu ze spisu treści	1
15394	Wikipedia	GoToElementNumber	go to the seventh element in contents	przejdź do ósmego elementu ze spisu treści	1
8864	Speaker	IncreaseVolume	volume up on speaker	zwiększ głośność głośnika	1
8866	Speaker	IncreaseVolume	turn up volume on my speaker	zrób głośniej mój głośnik	1
8882	Speaker	IncreaseVolume	speak louder please	mów głośniej proszę	1
8878	Speaker	IncreaseVolume	i want to hear that louder	chcę usłyszeć to głośniej	1
8871	Speaker	IncreaseVolume	make my speaker louder	podkrec głośność głośnika	1
8875	Speaker	IncreaseVolume	make my music volume louder	zrób odrobinę głośniej mój głośnik	0
8877	Speaker	IncreaseVolume	set music up	podkrec muzykę	1
8872	Speaker	IncreaseVolume	make my audio louder	zrób odrobinę głośniej mój głośnik	0
8876	Speaker	IncreaseVolume	raise my speaker 's volume up	zwieksz głośność mojego głośnika	1
8865	Speaker	IncreaseVolume	volume up on my speaker	głośniej mój głośnik	1
8842	Speaker	IncreaseVolumeByPercent	make the volume of my speaker higher by 4	zrób głośniej o 4 procent	0
8856	Speaker	IncreaseVolumeByPercent	set volume higher by 14	ustaw głośniej o 14 procent	1
8834	Speaker	IncreaseVolumeByPercent	increase volume of speaker by 78	zwiększ głośność o 78	1
8827	Speaker	IncreaseVolumeByPercent	turn up the volume more	zwieksz głośność	0
8833	Speaker	IncreaseVolumeByPercent	increase speaker 's volume by 75	zwiększ głośność o 75	0
8857	Speaker	IncreaseVolumeByPercent	set music higher by 45	nastaw muzykę na 45 procent	1
8835	Speaker	IncreaseVolumeByPercent	increase volume of my speaker by 56	zwiększ głośność o 56 procent	1
8846	Speaker	IncreaseVolumeByPercent	bring volume of speaker up by 20	zwiększ głośność o 20	1
8839	Speaker	IncreaseVolumeByPercent	make volume of speaker higher by 88	zrób głośniej o 88 procent	1
8829	Speaker	IncreaseVolumeByPercent	turn up volume more	zwieksz głośność	0
12981	Weather	MoonphaseInLocation	how moon looks in toyah	jak wygląda księżyc w toyah	1
12980	Weather	MoonphaseInLocation	get moon phase for saint robert	przejdź na fazę księżycową świętego roberta	0
12983	Weather	MoonphaseInLocation	what's moon like in south international falls	jaki jest księżyc w południowych tarasach	1
12979	Weather	MoonphaseInLocation	show me moon phase in nixon	pokaż mi faza księżyca w nixon	1
12978	Weather	MoonphaseInLocation	find out moon phase for summit	sprawdź faza księżyca na szczyt	0
12976	Weather	MoonphaseInLocation	check moon phase in paris	sprawdź faza księżyca w paryżu	0
12982	Weather	MoonphaseInLocation	can i see moon in terrace park	czy mogę zobaczyć księżyc w terrace park	1
12977	Weather	MoonphaseInLocation	tell me moon phase in dubai	powiedz mi faza księżyca w dubaju	0
12975	Weather	MoonphaseInLocation	check moonphase in paris	sprawdź faza księżyca w paryżu	0
12966	Weather	MoonphaseInLocationOnDate	how moon looks in round rock on 27th may	jak wygląda księżyc w rund rocku 27 maja	1
12961	Weather	MoonphaseInLocationOnDate	show me moon phase in bluff on 24th october	pokaż mi faza księżyca w blufie 24 października	0
12967	Weather	MoonphaseInLocationOnDate	how moon looks in great lakes on 27th October	jak wygląda księżyc w wielkich lakierach 27 października	0
12964	Weather	MoonphaseInLocationOnDate	get moon phase for dinwiddie on 3rd june	przejdź na fazę księżycową dinwiddie na 3 czerwca	0
12971	Weather	MoonphaseInLocationOnDate	can i see moon in north lakewood on 7th july	czy mogę zobaczyć księżyc w północnym jorku 7 lipca	0
12954	Weather	MoonphaseInLocationOnDate	mass city moon phase on 13th november	masowa faza księżyca miejskiego 13 listopada	0
12962	Weather	MoonphaseInLocationOnDate	show me moon phase in alfred station on 11th january	pokaż mi faza księżyca na stacji alfred 11 stycznia	0
12952	Weather	MoonphaseInLocationOnDate	check moon phase in erin on 14th march	sprawdź faza księżyca w erin 14 marca	0
12963	Weather	MoonphaseInLocationOnDate	get moon phase for midland city on 9th September	przejdź na fazę księżycową w środkowym mieście 9 września	0
12970	Weather	MoonphaseInLocationOnDate	can i see moon in dunfermline on 8th September	czy mogę zobaczyć księżyc w dunfermline 8 września	1
8901	Speaker	MuteOff	don't be so silent	nie bądź tak cicho	1
8883	Speaker	MuteOff	unmute my speaker	wylacz wyciszenie mojego głośnika	0
8896	Speaker	MuteOff	stop any sound from the speaker	zatrzymaj dowolny dźwięk z głośnika	1
8900	Speaker	MuteOff	unpause sound from the speaker	ustaw dźwięk na moim głośniku	0
8885	Speaker	MuteOff	turn on speaker 's volume	włącz dzwięk na moim głośniku	1
8889	Speaker	MuteOff	turn on my speaker 's volume	włącz dzwięk na moim głośniku	1
8884	Speaker	MuteOff	unmute the speaker	wylacz wyciszenie głośnika	0
8899	Speaker	MuteOff	unpause sound from my speaker	ustaw dźwięk na moim głośniku	1
8898	Speaker	MuteOff	unpause sound from speaker	ustaw dźwięk na moim głośniku	0
8903	Speaker	MuteOff	surprise me with some audio	zaskoczę mnie jakimś audio	1
8934	Speaker	MuteOn	be mute for thirty minutes	bądź wyciszony przez trzydzieści minut	1
8939	Speaker	MuteOn	cut off this noise	wyłącz tę halas	0
8908	Speaker	MuteOn	mute audio	wycisz audio	1
8924	Speaker	MuteOn	pause my speaker	zatrzymaj mój głośnik	1
8929	Speaker	MuteOn	shut down my sound	wyłącz mój dźwięk	1
8918	Speaker	MuteOn	go silent for a moment	bądź cicho na chwilę	1
8916	Speaker	MuteOn	turn off the speaker 's sound	wyłącz dźwięk na moim głośniku	1
8919	Speaker	MuteOn	go silent until tomorrow	bądź cicho do jutra	1
8920	Speaker	MuteOn	pause music	zatrzymaj muzykę	1
8936	Speaker	MuteOn	shut up please	zamknij się proszę	1
9707	Spotify	NextSong	that track is bad	ta utwór jest zła	0
9686	Spotify	NextSong	next track on spotify	następny utwór na spotify	1
9689	Spotify	NextSong	play next track on spotify	puść następną utwór na spotify	0
9701	Spotify	NextSong	let's listen to anther song on spotify	posłuchajmy piosenki anter na spotify	0
9690	Spotify	NextSong	play the next song	zagraj następną piosenkę	1
9699	Spotify	NextSong	let's listen to next track	posłuchajmy następnego utworu	1
9715	Spotify	NextSong	i hate that song	nienawidzę tej piosenki	1
9698	Spotify	NextSong	skip than track on spotify	pomiń niż utwór na spotify	1
9695	Spotify	NextSong	skip than song	pomiń niż piosenka	0
9692	Spotify	NextSong	play the next track	odtwarzaj następną utwór	0
16270	Youtube	NextVideo	i don't want that video	nie chcę tego wideo	1
16263	Youtube	NextVideo	play next movie	zagraj następny film	1
16266	Youtube	NextVideo	go to the next movie	przejdź do następnego filmu	1
16268	Youtube	NextVideo	ast forward that vidio	przekaż ten widio	0
16267	Youtube	NextVideo	show me next movie	pokaż mi następny film	1
16264	Youtube	NextVideo	go to next movie	przejdź do następnego filmu	1
16269	Youtube	NextVideo	fast forward that video	szybko prześlij to wideo	0
16265	Youtube	NextVideo	go to the next video	przejdź do następnego wideo	1
4158	Calendar	NotifyOnEventInLocation	notify me when an event in my calendar in aydlett begins	powiadom mnie kiedy wydarzenie w moim kalendarzu w aydlett się rozpocznie	1
4172	Calendar	NotifyOnEventInLocation	let me know when an appointment in my calendar in rosemount begins	daj mi znać kiedy spotkanie w moim kalendarzu w rosemount się rozpocznie	1
4177	Calendar	NotifyOnEventInLocation	let me know when an event in the calendar in location avella begins	daj mi znać kiedy wydarzenie w kalendarzu w lokalizacji avella się rozpocznie	1
4150	Calendar	NotifyOnEventInLocation	tell me when a meeting in the calendar in location slack begins	powiedz mi kiedy spotkanie w kalendarzu na slacku się rozpocznie	0
4191	Calendar	NotifyOnEventInLocation	give me a notice when an event in the calendar in abingdon begins	daj mi znać kiedy wydarzenie w kalendarzu w abingdon się rozpocznie	1
4173	Calendar	NotifyOnEventInLocation	let me know when an appointment in the calendar in twin city begins	daj mi znać kiedy spotkanie w kalendarzu w bliźniakowie się rozpocznie	0
4181	Calendar	NotifyOnEventInLocation	remind me when an appointment in the calendar in fountainebleau begins	przypomnij mi kiedy spotkanie w kalendarzu w fountainebleau się rozpocznie	1
4163	Calendar	NotifyOnEventInLocation	alert me when an appointment in my calendar in location johns island begins	powiadom mnie kiedy spotkanie na wyspie johns się rozpocznie w kalendarzu	1
4185	Calendar	NotifyOnEventInLocation	remind me when an event in the calendar in location galesburg begins	przypomnij mi kiedy wydarzenie w kalendarzu w galesburgu się rozpocznie	1
4193	Calendar	NotifyOnEventInLocation	update me when an appointment in my calendar in purley begins	powiadom mnie kiedy spotkanie w kalendarzu w purley się rozpocznie	1
4232	Calendar	NotifyOnEventStart	let me know when an appointment in the calendar begins	daj mi znać kiedy spotkanie w kalendarzu się rozpocznie	1
4208	Calendar	NotifyOnEventStart	tell me when an event from the calendar begins	powiedz mi kiedy wydarzenie w kalendarzu się rozpocznie	1
4259	Calendar	NotifyOnEventStart	update me when an event from the calendar begins	powiadom mnie kiedy wydarzenie w kalendarzu się zacznie	0
4235	Calendar	NotifyOnEventStart	let me know when an event in the calendar begins	daj mi znać kiedy wydarzenie w kalendarzu się rozpocznie	1
4228	Calendar	NotifyOnEventStart	inform me when an appointment from the calendar begins	powiadom mnie kiedy spotkanie w kalendarzu się rozpocznie	1
4251	Calendar	NotifyOnEventStart	give me a notice when an event from my calendar begins	daj mi znać kiedy wydarzenie w kalendarzu się rozpocznie	1
4225	Calendar	NotifyOnEventStart	inform me when an appointment in my calendar begins	powiadom mnie kiedy spotkanie w moim kalendarzu się rozpocznie	0
4224	Calendar	NotifyOnEventStart	inform me when a meeting from the calendar begins	powiadom mnie kiedy spotkanie w kalendarzu się rozpocznie	0
4258	Calendar	NotifyOnEventStart	update me when an event from my calendar begins	powiadom mnie kiedy wydarzenie w kalendarzu się zacznie	0
4252	Calendar	NotifyOnEventStart	give me a notice when an event from the calendar begins	daj mi znać kiedy wydarzenie w kalendarzu się rozpocznie	1
16278	Youtube	NotifyOnNewFromFollowing	notify me if there is new video on channel i follow	poinformuj mnie jeśli pojawi się nowe wideo na kanale który followuję	0
16280	Youtube	NotifyOnNewFromFollowing	inform me when there is a new video from youtube channels i follow	powiadom mnie jeśli pojawi się nowe wideo na kanale który followuję	0
16292	Youtube	NotifyOnNewFromFollowing	update me when there is a new video from youtube channels i follow	poinformuj mnie kiedy pojawi się nowe wideo na kanale który followuję	0
16299	Youtube	NotifyOnNewFromFollowing	i want to be updated if there is new video from youtube channels i follow	chcę być aktualizowany jeśli pojawi się nowe wideo na kanale który followuję	1
16287	Youtube	NotifyOnNewFromFollowing	let me know when there is a new video on channel i follow	daj mi znać kiedy pojawi się nowe wideo na kanale który followuję	1
16274	Youtube	NotifyOnNewFromFollowing	tell me if there is a new video on channel i follow	powiedz mi jeśli pojawi się nowe wideo na kanale który followuję	1
16295	Youtube	NotifyOnNewFromFollowing	update me if there is new video on channel i follow	poinformuj mnie jeśli pojawi się nowe wideo na kanale który followuję	0
16294	Youtube	NotifyOnNewFromFollowing	update me if there is new video from youtube channels i follow	poinformuj mnie jeśli pojawi się nowe wideo na kanale który followuję	0
16282	Youtube	NotifyOnNewFromFollowing	inform me if there is new video on channel i follow	poinformuj mnie jeśli pojawi się nowe wideo na kanale który followuję	1
16297	Youtube	NotifyOnNewFromFollowing	i want to be updated when there is a new video from youtube channels i follow	chcę być aktualizowany gdy pojawi się nowe wideo na kanale który followuję	1
7161	Fitbit	NotifyOnWeight	let me know when my weight is over 81 kg	daj mi znać kiedy przytyję powyżej 81 kg	1
7143	Fitbit	NotifyOnWeight	tell me if my weight is over 100 kg	powiedz mi kiedy przytyję powyżej 100 kg	1
7162	Fitbit	NotifyOnWeight	let me know when my weight is higher than 200 pounds	daj mi znać kiedy moja waga będzie większa niż 200 funtów	1
7146	Fitbit	NotifyOnWeight	tell me when my weight is over 73 kg	powiedz mi kiedy przytyję powyżej 73 kg	1
7158	Fitbit	NotifyOnWeight	let me know if my weight is higher than 82 kg	daj mi znać kiedy moja waga będzie większa niż 82 kg	1
7151	Fitbit	NotifyOnWeight	notify me when my weight is over 72 kg	poinformuj mnie kiedy przytyję powyżej 72 kg	0
7150	Fitbit	NotifyOnWeight	notify me when my weight goes higher than 79 kg	poinformuj mnie kiedy moja waga będzie większa niż 79 kg	0
7147	Fitbit	NotifyOnWeight	notify me if my weight is over 66 kg	poinformuj mnie kiedy przytyję powyżej 66 kg	0
7165	Fitbit	NotifyOnWeight	update me when my weight goes higher than 85 kg	aktualizuj moją wagę kiedy będzie większa niż 85 kg	1
7159	Fitbit	NotifyOnWeight	let me know when my weight goes over 61 kg	daj mi znać kiedy przytyję powyżej 61 kg	1
4264	Calendar	NotifyWhenEventNameStart	tell me the date of a meeting lunch with sam holmberg in the calendar	powiedz mi w kalendarzu datę obiadu z samem holmbergem	0
4289	Calendar	NotifyWhenEventNameStart	inform me the time of an appointment frederic birhday in my calendar	informuj mnie o czasie spotkania w kalendarzu	0
4310	Calendar	NotifyWhenEventNameStart	let me know the hour of an appointment flight to north pomfret in the calendar	daj mi znać godzinę lotu z wizytą na północną pomfret w kalendarzu	0
4268	Calendar	NotifyWhenEventNameStart	tell me the hour of a meeting meeting with anna in the calendar	powiedz mi godzinę spotkania z aną w kalendarzu	1
4265	Calendar	NotifyWhenEventNameStart	tell me the date of an appointment neighborhood council in my calendar	powiedz mi datę spotkania z radą sąsiadową w moim kalendarzu	0
4275	Calendar	NotifyWhenEventNameStart	notify me the hour of an event melissa birhday in my calendar	powiadom mnie o godzinie wydarzenia melissa birhday w moim kalendarzu	1
4326	Calendar	NotifyWhenEventNameStart	give me a notice the date of a meeting dinner with priscilla beyrer in the calendar	daj mi znać w kalendarzu datę kolacji z priscilla birerem	0
4284	Calendar	NotifyWhenEventNameStart	alert me the date of a meeting meeting with medea in the calendar	powiadom mnie o dniu spotkania z medią w kalendarzu	1
4287	Calendar	NotifyWhenEventNameStart	alert me the hour of a meeting dinner with jay lahr in my calendar	powiadom mnie o godzinie kolacji z Jayem lahrem w moim kalendarzu	1
4327	Calendar	NotifyWhenEventNameStart	give me a notice the date of an appointment dinner with venetia in my calendar	daj mi znać w moim kalendarzu datę obiadu z venetją	0
8148	News	NotifyWhenPortalUpdates	inform me when there is an update on wired front page	powiadom mnie jeśli pojawi się aktualizacja wiersza na pierwszej stronie	0
8150	News	NotifyWhenPortalUpdates	follow latest news from huffington post	śledź najnowsze wiadomości z huffington post	1
8147	News	NotifyWhenPortalUpdates	alert me when there is an update on nyt front page	powiadom mnie jeśli pojawi się aktualizacja na nowej pierwszej stronie	0
8146	News	NotifyWhenPortalUpdates	notify me when there is an update on techcrunch front page	poinformuj mnie kiedy pojawi się aktualizacja na pierwszej stronie techcrunch	1
8149	News	NotifyWhenPortalUpdates	let me know when there is an update on time magazine front page	daj mi znać kiedy pojawi się aktualizacja na pierwszej stronie czasopisma	0
8151	News	NotifyWhenPortalUpdates	i want to be up to date when there is an update on huffpost front page	chcę być do końca kiedy pojawi się aktualizacja na pierwszej stronie huffpost	0
8092	News	NotifyWhenPortalUpdatesInSection	inform me when the nyt portal tech section publishes a article	powiadom mnie jeżeli <a>nowy<a> sekcja technologiczna opublikuje artykuły	0
8042	News	NotifyWhenPortalUpdatesInSection	tell me when the fox news portal in tech section publishes a new article	powiedz mi kiedy fox news portal w sekcji technologii opublikuje nowe artykuły	1
8120	News	NotifyWhenPortalUpdatesInSection	i want to be up to date when the techcrunch portal in sport section publishes a new article	chcę się dowiedzieć kiedy <a>techcrunch<a> w części sportowej opublikuje nowe artykuły	1
8081	News	NotifyWhenPortalUpdatesInSection	alert me when the huffpost portal health section publishes a new article	powiadom mnie kiedy huffpost w części zdrowotnej opublikuje nowe artykuły	1
8063	News	NotifyWhenPortalUpdatesInSection	notify me when the techcrunch in tech section publishes a article	poinformuj mnie kiedy <a>techcrunch<a> w sekcji technologii opublikuje artykuły	1
8044	News	NotifyWhenPortalUpdatesInSection	tell me when the ny times health section publishes a new article	powiedz mi kiedy ny times w części zdrowia opublikuje nowe artykuły	0
8100	News	NotifyWhenPortalUpdatesInSection	let me know when the time portal in health section publishes a article	daj mi znać kiedy czas w części zdrowia opublikuje artykuły	0
8078	News	NotifyWhenPortalUpdatesInSection	alert me when the fox news in sport section publishes a new article	powiadom mnie kiedy fox news w części sportowej opublikuje nowe artykuły	1
8119	News	NotifyWhenPortalUpdatesInSection	i want to be up to date when the huffpost portal in celebrity section publishes a article	chcę być do końca kiedy huffpost w części o celebrytach opublikuje artykuły	0
8093	News	NotifyWhenPortalUpdatesInSection	inform me when the ny times portal health section publishes a article	powiadom mnie kiedy ny times w części zdrowotnej opublikuje artykuły	0
3924	Calendar	NotNotifyOnEventInLocation	dant notify me when an event in my calendar in location roswell begins	dant poinformuj mnie kiedy wydarzenie w moim kalendarzu w roswell się rozpocznie	0
3943	Calendar	NotNotifyOnEventInLocation	don't alert me when an appointment in my calendar in ladner begins	nie powiadom mnie kiedy spotkanie w kalendarzu w ladner się rozpocznie	0
3974	Calendar	NotNotifyOnEventInLocation	don't let me know when an appointment in the calendar in biggleswade begins	nie pozwól mi wiedzieć kiedy spotkanie w kalendarzu w biggleswade się rozpocznie	0
3917	Calendar	NotNotifyOnEventInLocation	don't tell me when an event in my calendar in lake oswego begins	nie mów mi kiedy wydarzenie w moim kalendarzu w jezioro oswego się rozpocznie	1
4008	Calendar	NotNotifyOnEventInLocation	be silent when an event in my calendar in location whittier begins	bądź cicho kiedy wydarzenie w moim kalendarzu w okolicy białego zacznie się	0
3941	Calendar	NotNotifyOnEventInLocation	don't alert me when a meeting in my calendar in location kirkwood begins	nie powiadom mnie kiedy spotkanie w moim kalendarzu w miejscowości kirkwood się rozpocznie	0
3977	Calendar	NotNotifyOnEventInLocation	don't let me know when an event in my calendar in location algonquin begins	nie pozwól mi wiedzieć kiedy wydarzenie w moim kalendarzu w lokalizacji algonquin się rozpocznie	0
3983	Calendar	NotNotifyOnEventInLocation	don't remind me when an event in my calendar in orland park begins	nie przypomnij mi kiedy wydarzenie w moim kalendarzu w orland park się rozpocznie	0
3989	Calendar	NotNotifyOnEventInLocation	don't remind me when an appointment in my calendar in location radcliffe begins	nie przypomnij mi kiedy spotkanie w moim kalendarzu w miejscu gdzie radcliffe się rozpocznie	0
3953	Calendar	NotNotifyOnEventInLocation	don't inform me when a meeting in my calendar in lincoln park begins	nie powiadom mnie kiedy spotkanie w moim kalendarzu w lincoln park się rozpocznie	0
4081	Calendar	NotNotifyOnEventStart	don't inform me when an appointment in my calendar begins	nie powiadom mnie kiedy spotkanie w moim kalendarzu się rozpocznie	0
