id	domain	intent	src_utt	translated-tgt_utt	eval_text_translation
6849	Facebook	PostPictureWithUrlAndWithCaption	publish picture bit.ly/EwAwu on facebook with caption with simone	opublikuj zdjęcie bit.ly/EwAwu na facebooka z podpisem	0
6851	Facebook	PostPictureWithUrlAndWithCaption	publish link to picture bit.ly/DGSFh on my facebook with caption with mehitable	opublikuj link bit.ly/DGSFh na facebooka z podpisem	0
6825	Facebook	PostPictureWithUrlAndWithCaption	upload picture tinyurl.com/UF0sd on my facebook with caption with moira	upload zdjęcie tinyurl.com/UF0sd na facebooka z opisem na moira	0
7049	Facebook	PostStatus	update facebook wall saying it is not possible to have both things	zaktualizuj ścianę facebooka mówiąc, że nie można mieć obu rzeczy	1
7050	Facebook	PostStatus	update facebook wall saying we went to the restaurant and ate pasta	zaktualizuj ścianę facebooka mówiąc że poszliśmy do restauracji i zjadliśmy makaron	0
7025	Facebook	PostStatus	write on facebook why did she not speak yesterday	napisz na facebooka dlaczego nie rozmawiała wczoraj	1
7071	Facebook	PostStatus	notify everybody about yesterday i spoke with my brother	powiadom wszystkich o wczorajszej rozmowie z bratem	1
7012	Facebook	PostStatus	write post i do not eat chicken because i want fish on facebook	napisz post że nie zjadę kurczaka ponieważ chcę ryby na fejsie	0
7038	Facebook	PostStatus	create a new message about she eats chicken but does not eat fish on facebook	stwórz nową wiadomość o tym że ona jedzie kurczaka ale nie jedzie ryb na fejsie	0
7045	Facebook	PostStatus	create a new post about the season is from february to march on facebook	stwórz nowy post o sezonie od lutego do marca na fejsie	1
7015	Facebook	PostStatus	post a status the colonel talks with the soldiers on facebook	prześlij status pułkownika i jego żołnierzy na facebooka	0
7016	Facebook	PostStatus	post a status yes we have determined something on facebook	zapostuj status tak że zdecydowaliśmy się na coś na facebooku	0
7055	Facebook	PostStatus	update my facebook wall saying i cannot have scissors in my bag	zaktualizuj mój mur na facebooku mówiąc że nie mogę mieć w sobie szwy	0
7534	Instagram	PostWithLastPictureWithLocationAndWithHashtag	create a new post on instagram with the last photo from gallery adding amaro filter	zrób nowy post na instagramie z ostatniego zdjęcia z galerii i dodaj filtr amaro	1
7539	Instagram	PostWithLastPictureWithLocationAndWithHashtag	create a new post on insta with the last photo from gallery and add newpalette hashtag	zrób nowy post na instagramie z ostatniego zdjęcia z galerii i dodaj hashtag newpalette	1
7525	Instagram	PostWithLastPictureWithLocationAndWithHashtag	make a new post on insta with the last photo from gallery adding fitspo hashtag	zrób nowy post na instagramie z ostatniego zdjęcia z galerii i dodaj hashtag fitspo	1
7516	Instagram	PostWithLastPictureWithLocationAndWithHashtag	make a post on insta with the last photo from gallery and add resinjewelry hashtag	zrób post na instagrama z ostatniego zdjęcia z galerii i dodaj hashtag resinjewelry	1
7530	Instagram	PostWithLastPictureWithLocationAndWithHashtag	create a new post on instagram with the last photo from gallery	utwórz nowy post na instagramie z ostatniego zdjęcia z galerii	1
7518	Instagram	PostWithLastPictureWithLocationAndWithHashtag	make a new post on instagram with the last photo from gallery and a tag paris	zrób post na instagrama z ostatniego zdjęcia z galerii i z tagem paris	1
7538	Instagram	PostWithLastPictureWithLocationAndWithHashtag	create a new post on insta with the last photo from gallery and add rise filter	zrób nowy post na instagramie z ostatniego zdjęcia z galerii i dodaj filtr ryse	0
7554	Instagram	PostWithLastPictureWithLocationAndWithHashtag	compose a new post on insta with the last photo from gallery adding gingham filter	stwórz nowy post na instagramie z ostatniego zdjęcia z galerii i dodaj filtr gingham	1
7551	Instagram	PostWithLastPictureWithLocationAndWithHashtag	compose a new post on insta with the last photo from gallery	stwórz nowy post na instagramie z ostatniego zdjęcia z galerii	1
7553	Instagram	PostWithLastPictureWithLocationAndWithHashtag	compose a new post on insta with the last photo from gallery and add selfie hashtag	stwórz nowy post na instagramie z ostatniego zdjęcia z galerii i dodaj hashtag selfie	1
7567	Instagram	PostWithPicturesFromDateAndWithLocation	take photos from brainardsville and create instagram from it	weź zdjęcia z brainardsville i stwórz instagram z nich	1
7559	Instagram	PostWithPicturesFromDateAndWithLocation	create a new post on instagram with all my photos taken in cerrillos on the 11th of July as a collage	stwórz nowy post na instagramie ze wszystkimi moimi zdjęciami zrobionymi w cerrillos 11 lipca jako kolegi	0
7557	Instagram	PostWithPicturesFromDateAndWithLocation	make a new post on insta with all my photos taken in willisville on the 16th of February as a collage	zrób nowy post na instagramie ze wszystkimi zdjęciami zrobionymi w willisville 16 lutego jako kolegi	0
7564	Instagram	PostWithPicturesFromDateAndWithLocation	compose a new post on instagram with all my photos taken in shepherdstown on the 16th of January as a collage	stwórz nowy post na instagramie ze wszystkimi zdjęciami które zrobiłem w shepherdstown 16 stycznia jako kolage	1
7571	Instagram	PostWithPicturesFromDateAndWithLocation	compile my photos from tennga on instagram	kompiluj moje zdjęcia z tennga na instagramie	1
7570	Instagram	PostWithPicturesFromDateAndWithLocation	compile my photos from welling	kompiluj moje zdjęcia z welling	1
7563	Instagram	PostWithPicturesFromDateAndWithLocation	compose a post on insta with all my photos taken in killawog in April as a collage	stwórz post na instagramie ze wszystkimi zdjęciami zrobionymi w killawogu w kwietniu jako collage	0
7569	Instagram	PostWithPicturesFromDateAndWithLocation	compile photos from cedarvale on instagram	kompiluj zdjęcia z cedarvale na instagrama	1
7558	Instagram	PostWithPicturesFromDateAndWithLocation	make a new post on insta with all my photos taken in ahmeek in April as a collage	zrób nowy post na instagramie z wszystkimi zdjęciami zrobionymi w ahmeek w kwietniu jako kolage	1
7560	Instagram	PostWithPicturesFromDateAndWithLocation	create a new post on instagram with all my photos taken in stoutsville in June as a collage	stwórz nowy post na instagramie ze wszystkimi moimi zdjęciami zrobionymi w stoutsville w czerwcu jako kolage	1
9986	Spotify	PreviousSong	play the previous track	graj poprzednią utwór	1
9999	Spotify	PreviousSong	repeat last track	powtórz poprzednią utwór	0
9997	Spotify	PreviousSong	go back to the last track	wróć do poprzedniego utworu	1
9989	Spotify	PreviousSong	play the last song on spotify	zagraj poprzednią piosenkę na spotify	1
9994	Spotify	PreviousSong	rewind to the last track	przejdź do poprzedniego utworu	1
9996	Spotify	PreviousSong	go back to the last song	wróć do poprzedniej piosenki	1
9987	Spotify	PreviousSong	play the previous track on spotify	graj poprzednią utwór na spotify	0
9991	Spotify	PreviousSong	play the last track on spotify	graj poprzednią utwór na spotify	0
9995	Spotify	PreviousSong	rewind to the last track on spotify	przełącz na poprzednią utwór na spotify	0
9998	Spotify	PreviousSong	go back to the previous track	wróć do poprzedniego utworu	1
15636	Wikipedia	RandomPage	i want to learn something useful to day	chcę się nauczyć czegoś użytecznego do dzisiaj	0
15625	Wikipedia	RandomPage	display random wikipedia page	wyświetl losową stronę na wiki	1
15632	Wikipedia	RandomPage	wikipedia surf	przeglądarka wikipedii	0
15628	Wikipedia	RandomPage	shuffle random wiki article	shuffle losowy artykuł na wiki	0
15630	Wikipedia	RandomPage	surf wikipedia	surfuj na wikipedii	1
15627	Wikipedia	RandomPage	open random wikipedia article	otwórz losowy artykuł na wikipedii	1
15623	Wikipedia	RandomPage	show me random wikipedia article	pokaż losowy artykuł na wiki	1
15626	Wikipedia	RandomPage	open random wiki article	otwórz losowy artykuł na wiki	1
15624	Wikipedia	RandomPage	display random wiki article	wyświetl losowy artykuł na wiki	1
15635	Wikipedia	RandomPage	i want to learn something useful	chcę się nauczyć czegoś użytecznego	1
10000	Spotify	RepeatOnOff	set repeat on on that track	ustaw powtórzenie na tym utworze	1
10004	Spotify	RepeatOnOff	listen to this track again	posłuchaj tego utworu ponownie	1
10003	Spotify	RepeatOnOff	i want to repeat that song	chcę powtórzyć tę piosenkę	1
10001	Spotify	RepeatOnOff	change repeat to on state	zmień powtarzanie na stan	0
10002	Spotify	RepeatOnOff	repet that tri	powtórz ten utwór	1
6003	Email	ReplyToEmailFromAddress	write an response mail to nicolle@aol.com	napisz w odpowiedzi na emaila nicolle@aol.com	0
6007	Email	ReplyToEmailFromAddress	write an response mail to tallulah@gmail.com	napisz w odpowiedzi na emaila tallulah@gmail.com	0
5993	Email	ReplyToEmailFromAddress	respond to dorotea mail	odpisz na maila dorotea	1
5980	Email	ReplyToEmailFromAddress	answer denys email	odpowiedz na email od denys	1
5971	Email	ReplyToEmailFromAddress	send a reply to kim@gmail.com email	wyślij odpowiedź na email kim@gmail.com	1
5970	Email	ReplyToEmailFromAddress	send a reply to barbara a hueter email	wyślij odpowiedź na barbarzyński email	0
5999	Email	ReplyToEmailFromAddress	open a reply mail to josie	otwórz odpowiedź na maila josie	1
6009	Email	ReplyToEmailFromAddress	write an response mail to libenson	napisz w odpowiedzi na maila libenson	1
5992	Email	ReplyToEmailFromAddress	respond to kordula mail	odpisz na maila kordula	1
5983	Email	ReplyToEmailFromAddress	write an answer to donald lassere mail	napisz w odpowiedzi na maila donalda lassere'a	1
15641	Wikipedia	ScrollDown	go page down	przejdź stronę w dół	1
15638	Wikipedia	ScrollDown	page down a little bit	strona trochę w dół	1
15640	Wikipedia	ScrollDown	downward scroll now	scroll teraz w dół	0
15639	Wikipedia	ScrollDown	scroll down page	przeszukaj stronę w dół	0
15642	Wikipedia	ScrollDown	continue reading that	przeczytaj to dalej	1
15643	Wikipedia	ScrollUp	page page up	strona w górę	1
15647	Wikipedia	ScrollUp	go page up	przejdź stronę w górę	1
15646	Wikipedia	ScrollUp	upward scroll now	wskocz scroll teraz	0
15644	Wikipedia	ScrollUp	scroll page up	przejdź stronę w górę	1
15645	Wikipedia	ScrollUp	show me previous page	pokaż mi poprzednią stronę	1
15648	Wikipedia	ScrollUp	get back to what i just read	wróć do tego co właśnie czytałem	1
15786	Yelp	SearchByCategory	show moroccan food nearby	pokaż jedzenie moroka w pobliżu	0
15789	Yelp	SearchByCategory	showmalatian rest arrant urround here	pokaż malezyjski rest arrant wszędzie	0
15793	Yelp	SearchByCategory	search for peruvian restaurants around here	szukaj restauracje w okolicy peruvian	0
15804	Yelp	SearchByCategory	i want to eat some japanease	chcę zjeść trochę japonezji	0
15797	Yelp	SearchByCategory	display iranian restaurants around here	wyświetl restauracje w okolicy	0
15785	Yelp	SearchByCategory	find czech restaurants nearby	znajdź pobliskie czeskie restauracje w okolicy	0
15792	Yelp	SearchByCategory	search for caribbean food nearby	szukaj jedzenia z karaibach w pobliżu	0
15790	Yelp	SearchByCategory	show malaysian restaurants around here	pokaż restauracje w okolicy	0
15799	Yelp	SearchByCategory	display british restaurants nearby	wyświetl pobliskie restauracje brytyjskie	1
15802	Yelp	SearchByCategory	yelp ethiopian restaurants nearby	yelp etypialne restauracje w okolicy	0
15756	Yelp	SearchByCategoryInLocation	search for egyptian restaurants around rumford	szukaj restauracje w okolicy rumford	0
15763	Yelp	SearchByCategoryInLocation	display arabian restaurants near osterburg	pokaż arabskie restauracje w pobliżu osterburga	1
15747	Yelp	SearchByCategoryInLocation	find uzbek restaurants near cherry plain	znajdź restauracje w pobliżu cherry plain	0
15780	Yelp	SearchByCategoryInLocation	i want to eat vietnamese food in simla	chcę zjeść w simli wietnamską kuchnię	1
15757	Yelp	SearchByCategoryInLocation	search for hungarian food near burgin	szukaj węgierskich potraw w pobliżu burgina	1
15777	Yelp	SearchByCategoryInLocation	i want to eat something from singaporean food in normangee	chcę zjeść coś z singapurskiego jedzenia w normangee	1
15764	Yelp	SearchByCategoryInLocation	yelp himalayan restaurants near mobeetie	yelp restauracje na himalaya w pobliżu mobeetie	0
15748	Yelp	SearchByCategoryInLocation	show polish restaurants near wyalusing	pokaż restauracje w okolicy wyalusing	0
15746	Yelp	SearchByCategoryInLocation	find syrian food near north pomfret	znajdź syriińskie jedzenie w pobliżu pomfret	1
15776	Yelp	SearchByCategoryInLocation	i want to eat something frumsing the porian food in normage	chcę coś zjeść z pieczarkami poryan food w normage	0
15882	Yelp	SearchByQuery	display restaurant around here using yelp	pokaż restauracje na yelpie	1
15892	Yelp	SearchByQuery	yelp pizzas and pieces of hot wings nearby	yelp pizze i kawałki skrzydeł w pobliżu	1
15876	Yelp	SearchByQuery	show me australian restaurant nearby	pokaż australijską restaurację w pobliżu	1
15883	Yelp	SearchByQuery	display restaurants on yelp	wyświetl restauracje na yelpie	1
15881	Yelp	SearchByQuery	display restaurant around here using yelp	pokaż restauracje na yelpie	0
15868	Yelp	SearchByQuery	search for chicken manchow soup on yelp	szukaj zupy z kurczaka na yelpie	0
15866	Yelp	SearchByQuery	find portuguese restaurant around here	znajdź portugalską restaurację w okolicy	1
15879	Yelp	SearchByQuery	display restaurant nearby using yelp	pokaż jedzenie w pobliżu	0
15878	Yelp	SearchByQuery	display restaurant nearby on yelp	wyświetl restauracje w okolicy	0
15894	Yelp	SearchByQuery	yelp squid game cookie nearby	yelp squid game cookie niedaleko	0
15841	Yelp	SearchByQueryInLocation	display cincinnati chili around mcleod on yelp	wyświetl cincinnati chili around mcleod na yelpie	0
15833	Yelp	SearchByQueryInLocation	search for hungarian restaurant near west boxford	szukaj węgierskich restauracji w pobliżu west boxford	1
15857	Yelp	SearchByQueryInLocation	yelp szechuan restaurant around ricketts on yelp	yelp szechuan restauracje na yelpie	0
15821	Yelp	SearchByQueryInLocation	shore a schooler nelton	ściągnij ucznia neltona	0
15849	Yelp	SearchByQueryInLocation	yelp coffee shop near port reading on yelp	czytaj kawy w pobliżu	0
15850	Yelp	SearchByQueryInLocation	yelp pork chops near walstonburg on yelp	yelp restauracje z kurczakiem w okolicy walstonburga	0
15815	Yelp	SearchByQueryInLocation	find sushi bars near weatogue on yelp	znajdź sushi bary w pobliżu weatogue	1
15858	Yelp	SearchByQueryInLocation	i want to eat someting buffalo pizza in bapchule	chcę zjeść jedzoną pizzę z kurczakiem	0
15805	Yelp	SearchByQueryInLocation	find delicacies near polkton	znajdź jedzenie w pobliżu polkton	0
15843	Yelp	SearchByQueryInLocation	display michael's pizza in carter on yelp	pokaż michael's pizzę w centrum na yelpie	0
15967	Yelp	SearchByRating	search for restaurants rated higher than two star	wyszukaj restauracje o ocenach większych niż dwie gwiazdki	1
15970	Yelp	SearchByRating	display restaurants nearby with at least 2 star rating	pokaż jedzenie w pobliżu z co najmniej 2 gwiazdką oceną	0
15965	Yelp	SearchByRating	find three star restaurants on yelp	znajdź restauracje na yelpie z trzema gwiazdkami	1
15968	Yelp	SearchByRating	show four star restaurants on yelp	pokaż restauracje na yelpie z czterema gwiazdkami	1
15972	Yelp	SearchByRating	display 3 star restaurants on yelp	wyświetl restauracje na yelpie z 3 gwiazdkami	0
15969	Yelp	SearchByRating	shall restaurance reated higher than five star	czy restauracja ma wartość powyżej pięciu gwiazdek	1
15966	Yelp	SearchByRating	search for five star restaurants	szukaj pięciogwiazdkowych restauracji w okolicy	0
15974	Yelp	SearchByRating	yelp five star restaurants on yelp	yelp pięciogwiazdkowe restauracje na yelpie	1
15971	Yelp	SearchByRating	display two star restaurants	wyświetl dwie gwiazdkowe restauracje w okolicy	0
15973	Yelp	SearchByRating	yelp restaurants nearby with at least four star rating	yelp restauracje w pobliżu z przynajmniej czterema ocenami gwiazdek	0
15953	Yelp	SearchByRatingInLocation	yelp me restaurants better than 3 stars in north pownal	yelp restauracje w okolicy lepsze niż 3 gwiazdki	1
15914	Yelp	SearchByRatingInLocation	find me restaurants nearby with at least 2 star rating in melmore	znajdź restauracje w pobliżu które mają przynajmniej 2 ocen od gwiazdek	0
15910	Yelp	SearchByRatingInLocation	find me restaurants with at least 4 star rating in sandusky	znajdź restauracje w sandusky z przynajmniej 4 gwiazdkimi ocenami	0
15905	Yelp	SearchByRatingInLocation	find restaurants with at least 5 stars in port neches	znajdź restauracje w port neches z przynajmniej 5 gwiazdek	0
15903	Yelp	SearchByRatingInLocation	find restaurants with at least 4 star rating in owasso	znajdź restauracje w owasso z co najmniej 4 gwiazdkowymi ocenami	0
15926	Yelp	SearchByRatingInLocation	show me restaurants nearby with at least two star rating near bloomingburg	pokaż mi restauracje w pobliżu które mają przynajmniej dwie gwiazdki	0
15923	Yelp	SearchByRatingInLocation	show me restaurants with at least 5 star rating in minisink hills	pokaż restauracje w okolicy które mają przynajmniej 5 gwiazdek	0
15952	Yelp	SearchByRatingInLocation	yelp me restaurants rated higher than two stars in otoe	yelp restauracje w otoe które mają wyższe niż dwie gwiazdki	0
15941	Yelp	SearchByRatingInLocation	search for restaurants nearby with at least three stars near mozier	wyszukaj restauracje w pobliżu które mają przynajmniej trzy gwiazdki	0
15901	Yelp	SearchByRatingInLocation	find me restaurants nearby with at least 2 stars in lincoln acres	znajdź restauracje w pobliżu które mają przynajmniej 2 gwiazdki	0
16006	Yelp	SearchByReviewCount	show restaurants here reviewed by more than 1000 people	pokaż restauracje w okolicy które mają przynajmniej 1000 ocen od ludzi	1
16020	Yelp	SearchByReviewCount	yelp restaurants nearby reviewed by at least 500 users	yelp restauracje w pobliżu które mają przynajmniej 500 ocen od użytkowników	1
16012	Yelp	SearchByReviewCount	show restaurants nearby reviewed by more than 10000 users	pokaż restauracje w pobliżu które mają przynajmniej 10.000 ocen od użytkowników	1
16017	Yelp	SearchByReviewCount	display restaurants nearby reviewed by at least 500 users	pokaż restauracje w pobliżu które mają przynajmniej 500 ocen od użytkowników	1
16018	Yelp	SearchByReviewCount	display restaurants nearby reviewed by more than 1000 people	pokaż restauracje w pobliżu które mają przynajmniej 1000 ocen od ludzi	1
16009	Yelp	SearchByReviewCount	shall restaurants near by reviewed by at least five hundred users	czy restauracje w pobliżu mają przynajmniej pięćset ocen od użytkowników	1
16027	Yelp	SearchByReviewCount	i want to eat at some popular place	chcę zjeść w popularnym miejscu	1
16004	Yelp	SearchByReviewCount	find restaurants here reviewed by more than 1000 people	znajdź restauracje w okolicy które mają przynajmniej 1000 ocen od ludzi	1
16026	Yelp	SearchByReviewCount	i want to eat at popular restaurant	chcę zjeść w popularnej restauracji	1
16008	Yelp	SearchByReviewCount	show restaurants nearby reviewed by at least 100 people	pokaż restauracje w pobliżu które mają przynajmniej 100 ocen od ludzi	1
15977	Yelp	SearchByReviewCountInLocation	find restaurants near plentywood reviewed by at least 1000 people	znajdź restauracje w okolicy plentywood które mają przynajmniej 1000 ocen od ludzi	1
15984	Yelp	SearchByReviewCountInLocation	search for restaurants near keno reviewed by at least 1000 people	wyszukaj restauracje w pobliżu keno które mają przynajmniej 1000 ocen od ludzi	1
15992	Yelp	SearchByReviewCountInLocation	display restaurants near willshire reviewed by more than 10000 people	pokaż restauracje w pobliżu willshire które mają przynajmniej 10.000 ocen od ludzi	1
16001	Yelp	SearchByReviewCountInLocation	i want to eat something good in olds popular restaurant	chcę zjeść coś dobrego w popularnej restauracji olds	1
15982	Yelp	SearchByReviewCountInLocation	show restaurants near fedora reviewed by at least 1000 people	pokaż restauracje w pobliżu fedora które mają przynajmniej 1000 ocen od ludzi	1
15983	Yelp	SearchByReviewCountInLocation	show restaurants near grand lake stream reviewed by more than 10000 people	pokaż restauracje w pobliżu grand lake stream które mają przynajmniej 10.000 ocen od ludzi	1
15987	Yelp	SearchByReviewCountInLocation	search for restaurants around yawkey reviewed by more than 500 people	wyszukaj restauracje w okolicy yawkey które mają przynajmniej 500 ocen od ludzi	1
15976	Yelp	SearchByReviewCountInLocation	find restaurants near munday reviewed by more than 10000 people	znajdź restauracje w pobliżu munday które mają przynajmniej 10.000 ocen od ludzi	1
15997	Yelp	SearchByReviewCountInLocation	i want to eat in east woodstock restaurant	chcę zjeść w restauracji w east woodstock	1
15995	Yelp	SearchByReviewCountInLocation	i want to eat something good in artois popular restaurant	chcę zjeść coś dobrego w popularnej restauracji artois	1
13268	Websearch	SearchImagesOnEngine	i want pizza hut menu images	chcę zdjęcia z menu pizzy hut	1
13262	Websearch	SearchImagesOnEngine	display images matching earl sweatshirt	pokaż obrazki pasujące do włosów	0
13263	Websearch	SearchImagesOnEngine	show me images matching slope formula	pokaż mi obrazki pasujące do formuli slacku	0
13260	Websearch	SearchImagesOnEngine	search for images matching atari breakout	szukaj obrazów pasujących do atari breakout	1
13258	Websearch	SearchImagesOnEngine	find joker images images	znajdź obrazki jokera	1
13264	Websearch	SearchImagesOnEngine	show me qr code images	pokaż mi zdjęcia z kodu qr	0
13266	Websearch	SearchImagesOnEngine	i want running memimages	chcę uruchomić memimages	0
13267	Websearch	SearchImagesOnEngine	i want running meme images	chcę uruchomić obrazki meme	0
13261	Websearch	SearchImagesOnEngine	search for heisenberg images	szukaj zdjęć heisenberg	1
13259	Websearch	SearchImagesOnEngine	find mike trout images	znajdź mi obrazy michała trout	0
14998	Websearch	SearchImagesWithTextOnEngine	find gordon ramsay images using google	znajdź zdjęcia gordon ramsay na google	1
15038	Websearch	SearchImagesWithTextOnEngine	i want aesthetic wallpaper images with duckduckgo	chcę zdjęcia z tapetami na duckduckgo	0
15032	Websearch	SearchImagesWithTextOnEngine	i want steven universe images on google	chcę zobaczyć zdjęcia z wszechświata na google	0
15009	Websearch	SearchImagesWithTextOnEngine	search for south of france haircut images using google	wyszukaj południowe zdjęcia fryzjera france na google	0
14994	Websearch	SearchImagesWithTextOnEngine	find pictures matching burito hat from duckduckgo	znajdź zdjęcia pasujące do burito hat z duckduckgo	1
14997	Websearch	SearchImagesWithTextOnEngine	find nebulae images using bing	znajdź obrazki nebulae w bing	1
15037	Websearch	SearchImagesWithTextOnEngine	i want easter images images with google	chcę zdjęcia wielkanocne z google	1
15021	Websearch	SearchImagesWithTextOnEngine	show me pictures matching yolo from bing	pokaż mi zdjęcia pasujące do yolo w bing	1
15034	Websearch	SearchImagesWithTextOnEngine	i want minecraft castle images using google	chcę obrazki minecraft castle przy użyciu google	0
14999	Websearch	SearchImagesWithTextOnEngine	fine people of walmort images using to conptue	fine people of walmort images using conptue	0
14587	Websearch	SearchImagesWithTextOnEngineWithWidthAndWithHeight	find ipad mini 4 images on bing of size 800 x 600	znajdź mi zdjęcia z ipad mini 4 z rozmiarem 800 x 600	1
14684	Websearch	SearchImagesWithTextOnEngineWithWidthAndWithHeight	search for nebulae images on duckduckgo of size 800 on 600	szukaj obrazów nebulae na duckduckgo of size 800 on 600	0
14785	Websearch	SearchImagesWithTextOnEngineWithWidthAndWithHeight	display big bang theory images with duckduckgo of size 800 on 600	pokaż zdjęcia z teorią big bang z duckduckgo z rozmiarem 800 na 600	0
14735	Websearch	SearchImagesWithTextOnEngineWithWidthAndWithHeight	display images matching kate moss on bing with size 800 on 600	pokaż obrazki pasujące do kate moss na bing z rozmiarem 800 na 600	1
14661	Websearch	SearchImagesWithTextOnEngineWithWidthAndWithHeight	search for images matching joker images using google of size 800 x 600	wyszukaj obrazki pasujące do obrazków jokera z google of size 800 x 600	0
14669	Websearch	SearchImagesWithTextOnEngineWithWidthAndWithHeight	search for images matching trippy drawings with bing of size 800 x 600	szukaj obrazów pasujących do rysunków trippy z bingami o rozmiarze 800 x 600	0
14880	Websearch	SearchImagesWithTextOnEngineWithWidthAndWithHeight	i want high scalability images on bing of size 800 x 600	chcę mieć duże rozmiarze obrazków na bing z rozmiarem 800 x 600	0
14892	Websearch	SearchImagesWithTextOnEngineWithWidthAndWithHeight	i want gap clothes images using google with size 800 x 600	chcę usunąć obrazki odzieży za pomocą google z rozmiarem 800 x 600	0
14775	Websearch	SearchImagesWithTextOnEngineWithWidthAndWithHeight	display happy new year 2020 image images using google with size 800 on 600	pokaż szczęśliwego nowego roku 2020 zdjęcia z google z rozmiarem 800 na 600	0
14693	Websearch	SearchImagesWithTextOnEngineWithWidthAndWithHeight	search for bed bugs bites images with google with size 800 x 600	wyszukaj bity obrazów z google o rozmiarze 800 x 600	0
13849	Websearch	SearchImagesWithTextOnEngineWithWidthAndWithHeightAndWithCondition	search for images matching game using google larger 800 x 600	szukaj gry które pasuje do obrazków przy użyciu google larger 800 x 600	0
